{
  "schema_version": 2,
  "execution_request_hash": "sha256:0101010101010101010101010101010101010101010101010101010101010101",
  "task_policy_hash": "sha256:0202020202020202020202020202020202020202020202020202020202020202",
  "authorization_decision_hash": "sha256:0303030303030303030303030303030303030303030303030303030303030303",
  "policy_decision_hash": "sha256:0404040404040404040404040404040404040404040404040404040404040404",
  "conformance_evaluation_hashes": [
    "sha256:0505050505050505050505050505050505050505050505050505050505050505"
  ],
  "intent_evaluation_hash": "sha256:0606060606060606060606060606060606060606060606060606060606060606",
  "task_scope_status": "WITHIN_APPROVED_ACCESS",
  "review_status": "NOT_REQUIRED",
  "decision_reason_code": "POLICY_CONFORMANT",
  "approval_evidence_hash": null,
  "decided_at": 1000
}
